{
  "operation": "sdk_edit@4",
  "version": 4,
  "manifestHash": "aaaaaaaaaaaaaaaaaaaaaaaaaaaaaaaaaaaaaaaaaaaaaaaaaaaaaaaaaaaaaaaa",
  "profile": "lod0_diagnostic",
  "bindTransport": "exporter",
  "selectedMeshes": [
    "body_LOD0"
  ],
  "excludedMeshes": [
    "body_LOD1"
  ],
  "scales": [],
  "acknowledge": [
    "single_lod",
    "sdk_regenerated_blocks",
    "native_frames_unverified",
    "source_export_fidelity_unverified"
  ],
  "surface": {
    "mesh": "body_LOD0",
    "blendPath": "return.blend",
    "blendHash": "aaaaaaaaaaaaaaaaaaaaaaaaaaaaaaaaaaaaaaaaaaaaaaaaaaaaaaaaaaaaaaaa",
    "geometryMode": "authored",
    "sourceTriangles": [
      0
    ],
    "editableVertices": [
      0,
      1,
      2
    ],
    "addedVertices": [
      {
        "sourceTriangle": 0,
        "barycentric": [
          0.3333333333333333,
          0.3333333333333333,
          0.3333333333333333
        ]
      }
    ],
    "faces": [
      {
        "sourceTriangle": 0,
        "vertices": [
          0,
          1,
          3
        ]
      },
      {
        "sourceTriangle": 0,
        "vertices": [
          1,
          2,
          3
        ]
      },
      {
        "sourceTriangle": 0,
        "vertices": [
          2,
          0,
          3
        ]
      }
    ],
    "maxDisplacement": 2,
    "maxBoundaryAngleChange": 15,
    "sections": [
      {
        "name": "center",
        "normal": [
          1,
          0,
          0
        ],
        "offset": 0.5
      }
    ],
    "unchangedControlPath": "synthetic-control",
    "unchangedControlHash": "aaaaaaaaaaaaaaaaaaaaaaaaaaaaaaaaaaaaaaaaaaaaaaaaaaaaaaaaaaaaaaaa"
  }
}
